MCQ,Choices,Correct
What is biology the scientific study of?,a: Physics | b: Chemistry | c: Life | d: Astronomy,Life
Which of the following is a unifying theme in biology?,a: All organisms are made up of cells | b: Planets orbit the sun | c: Chemical reactions | d: Gravitational force,All organisms are made up of cells
What major theme in biology explains the unity and diversity of life?,a: Photosynthesis | b: Evolution | c: Magnetism | d: Gravity,Evolution
"Which process is important to life because it allows organisms to move, grow, and reproduce?",a: Energy processing | b: Evaporation | c: Condensation | d: Erosion,Energy processing
"What do biologists use to make observations, pose questions, generate hypotheses, perform experiments, and form conclusions?",a: Astrological charts | b: Scientific method | c: Magic spells | d: Random guesses,Scientific method
